{"format":"maplab.map","version":1,"id":"map.platform.jump-none","metadata":{"name":"Owned platform jump-none","description":"Original ML-032 numeric fixture","authors":["MapLab"],"license":"CC0-1.0","tags":["conformance","ml-032"]},"requiredFeatures":[{"key":"maplab.collision","version":1},{"key":"maplab.camera","version":1}],"coordinates":{"units":"WU","x":"right","y":"down","rotation":"clockwiseDegrees","quantum":0.0625,"ticksPerSecond":60},"bounds":[0,0,640,640],"collisionContract":{"key":"maplab.collision","version":1},"dependencies":[],"assets":[],"presentations":[],"layers":[{"id":"layer.actors","name":"Actors","kind":"actors","parentId":null,"order":0,"visible":true,"opacity":1}],"terrain":[],"visuals":[],"materials":[{"id":"material.ground","name":"Ground","traction":256,"conveyorSu":0,"effect":null,"tags":[]}],"bodies":[{"id":"body.floor","name":"floor","position":[0,0],"enabled":true,"mobility":"kinematic","category":"world","mask":["actor"],"materialId":"material.ground","shapes":[{"id":"shape.floor","kind":"rect","rect":[0,100,256,32]}],"motion":{"points":[[0,0],[4,-4]],"legTicks":[4],"mode":"once","initialPhaseTicks":0,"easing":"linear","carry":"delta","departure":"none","crushAction":null}}],"footholds":[{"id":"fh.floor","name":"floor","ownerBodyId":"body.floor","a":[0,100],"b":[256,100],"normal":"up","mode":"solid","solidEdge":{"bodyId":"body.floor","shapeId":"shape.floor","edgeIndex":0},"dropAllowed":false,"dropGroupId":null,"materialId":"material.ground","direction":"both","category":"world","mask":["actor"],"enabled":true,"connections":{"a":[],"b":[]},"planeId":null}],"traversals":[],"regions":[],"entities":[],"waypoints":[],"routes":[],"triggers":[],"encounters":[],"camera":{"model":{"key":"maplab.camera","version":1},"defaults":{"viewWU":[640,360],"zoom":1,"bounds":[0,0,640,640],"followX":true,"followY":true,"deadZone":[0.375,0.25,0.25,0.5],"dampingTicks":[8,12],"lookaheadWU":[80,64],"verticalPolicy":"platformSnap","climbFollow":true,"transitionTicks":15,"transition":"smoothstep"},"zones":[],"shakeEffects":[]},"environment":{"ambientColor":"#ffffff","effects":[],"zones":[]},"navigation":{"modeVolumes":[],"links":[],"overrides":[]},"flags":[],"prefabPlacements":[]}
