{
  "format": "maplab.map",
  "version": 1,
  "id": "map.riglab-proof",
  "metadata": {
    "name": "Owned RigLab proof",
    "description": "Portal arrival map with a return portal.",
    "authors": [
      "MapLab R1 specification"
    ],
    "license": "CC0-1.0",
    "tags": [
      "acceptance",
      "r1"
    ]
  },
  "requiredFeatures": [
    {
      "key": "maplab.collision",
      "version": 1
    },
    {
      "key": "maplab.camera",
      "version": 1
    }
  ],
  "coordinates": {
    "units": "WU",
    "x": "right",
    "y": "down",
    "rotation": "clockwiseDegrees",
    "quantum": 0.0625,
    "ticksPerSecond": 60
  },
  "bounds": [
    0,
    0,
    640,
    640
  ],
  "collisionContract": {
    "key": "maplab.collision",
    "version": 1
  },
  "dependencies": [
    {
      "id": "movement.player",
      "kind": "movement",
      "path": "movement/player.movement.json",
      "required": true
    },
    {
      "id": "catalog.core",
      "kind": "catalog",
      "path": "catalogs/core.catalog.json",
      "required": true
    },
    {
      "id": "rig.owned-armor",
      "kind": "riglab",
      "path": "presentations/0125db4619785e88fd61c49cf585414501f0463151d501b252ad5fbc1cb55520/manifest.json",
      "required": false
    }
  ],
  "assets": [
    {
      "id": "asset.armor",
      "path": "assets/431591125b4d/431591125b4d5162e68576f1e443c111b2b8cdf122abe2053129fb78024a5406.svg",
      "mediaType": "image/svg+xml",
      "wuPerAssetUnit": 1,
      "size": [
        8,
        12
      ]
    }
  ],
  "presentations": [
    {
      "id": "presentation.armor",
      "kind": "riglab",
      "bundleDependencyId": "rig.owned-armor",
      "expectedExportVersion": 1,
      "rigGroundAnchor": [
        0,
        0
      ],
      "worldUnitsPerRigUnit": {
        "num": 2,
        "den": 1
      },
      "nativeFacing": "right",
      "rootMotion": "visualOnly",
      "groundContact": "supportLine",
      "artSlots": [
        {
          "slot": "armor_pelvis",
          "assetId": "asset.armor",
          "pivot": [
            4,
            0
          ]
        },
        {
          "slot": "armor_leg_far",
          "assetId": "asset.armor",
          "pivot": [
            4,
            0
          ]
        },
        {
          "slot": "armor_leg_near",
          "assetId": "asset.armor",
          "pivot": [
            4,
            0
          ]
        },
        {
          "slot": "armor_torso",
          "assetId": "asset.armor",
          "pivot": [
            4,
            0
          ]
        },
        {
          "slot": "armor_arm_far",
          "assetId": "asset.armor",
          "pivot": [
            4,
            0
          ]
        },
        {
          "slot": "armor_arm_near",
          "assetId": "asset.armor",
          "pivot": [
            4,
            0
          ]
        },
        {
          "slot": "armor_head",
          "assetId": "asset.armor",
          "pivot": [
            4,
            0
          ]
        }
      ],
      "actions": [
        {
          "semantic": "locomotion.idle",
          "animation": "unarmed-idle",
          "fallbackSemantic": null
        },
        {
          "semantic": "locomotion.walk",
          "animation": "unarmed-walk",
          "fallbackSemantic": "locomotion.idle"
        },
        {
          "semantic": "locomotion.jump.rise",
          "animation": "unarmed-jump",
          "fallbackSemantic": null
        },
        {
          "semantic": "locomotion.fall",
          "animation": null,
          "fallbackSemantic": "locomotion.jump.rise"
        },
        {
          "semantic": "climb.ladder",
          "animation": null,
          "fallbackSemantic": null
        }
      ]
    }
  ],
  "layers": [
    {
      "id": "layer.sky",
      "name": "Sky",
      "parentId": null,
      "order": 0,
      "visible": true,
      "opacity": 1,
      "kind": "background",
      "space": "camera",
      "parallax": [
        0,
        0
      ],
      "origin": [
        0,
        0
      ],
      "repeat": "none",
      "repeatSize": [
        0,
        0
      ],
      "scrollWUPerTick": [
        0,
        0
      ],
      "phase": [
        0,
        0
      ],
      "occlusionFade": null
    },
    {
      "id": "layer.world",
      "name": "Ground art",
      "parentId": null,
      "order": 1,
      "visible": true,
      "opacity": 1,
      "kind": "sprite",
      "occlusionFade": null
    },
    {
      "id": "layer.actors",
      "name": "Actors",
      "parentId": null,
      "order": 2,
      "visible": true,
      "opacity": 1,
      "kind": "actors"
    }
  ],
  "terrain": [],
  "visuals": [
    {
      "id": "visual.sky",
      "name": "Sky",
      "layerId": "layer.sky",
      "parentId": null,
      "order": 0,
      "transform": {
        "position": [
          0,
          0
        ],
        "rotation": 0,
        "scale": [
          1,
          1
        ],
        "mirrorX": false,
        "mirrorY": false
      },
      "source": {
        "kind": "shape",
        "shape": {
          "kind": "rect",
          "rect": [
            0,
            0,
            640,
            360
          ]
        },
        "fill": "#cfe6da"
      },
      "bodyId": null
    },
    {
      "id": "visual.floor",
      "name": "Clearing ground art",
      "layerId": "layer.world",
      "parentId": null,
      "order": 0,
      "transform": {
        "position": [
          0,
          576
        ],
        "rotation": 0,
        "scale": [
          1,
          1
        ],
        "mirrorX": false,
        "mirrorY": false
      },
      "source": {
        "kind": "shape",
        "shape": {
          "kind": "rect",
          "rect": [
            0,
            0,
            640,
            64
          ]
        },
        "fill": "#5b7a3c"
      },
      "bodyId": null
    }
  ],
  "materials": [
    {
      "id": "material.earth",
      "name": "Earth",
      "traction": 256,
      "conveyorSu": 0,
      "effect": null,
      "tags": [
        "ground"
      ]
    }
  ],
  "bodies": [
    {
      "id": "body.floor",
      "name": "Clearing ground",
      "position": [
        0,
        0
      ],
      "enabled": true,
      "mobility": "static",
      "category": "world",
      "mask": [
        "actor"
      ],
      "materialId": "material.earth",
      "shapes": [
        {
          "id": "shape.floor",
          "kind": "rect",
          "rect": [
            0,
            576,
            640,
            64
          ]
        }
      ],
      "motion": null
    },
    {
      "id": "body.edges",
      "name": "World edges",
      "position": [
        0,
        0
      ],
      "enabled": true,
      "mobility": "static",
      "category": "world",
      "mask": [
        "actor"
      ],
      "materialId": "material.earth",
      "shapes": [
        {
          "id": "shape.edge.left",
          "kind": "segment",
          "a": [
            0,
            0
          ],
          "b": [
            0,
            576
          ]
        },
        {
          "id": "shape.edge.right",
          "kind": "segment",
          "a": [
            640,
            0
          ],
          "b": [
            640,
            576
          ]
        }
      ],
      "motion": null
    }
  ],
  "footholds": [
    {
      "id": "fh.floor",
      "name": "Clearing floor",
      "ownerBodyId": "body.floor",
      "a": [
        0,
        576
      ],
      "b": [
        640,
        576
      ],
      "normal": "up",
      "mode": "solid",
      "solidEdge": {
        "bodyId": "body.floor",
        "shapeId": "shape.floor",
        "edgeIndex": 0
      },
      "dropAllowed": false,
      "dropGroupId": null,
      "materialId": "material.earth",
      "direction": "both",
      "category": "world",
      "mask": [
        "actor"
      ],
      "enabled": true,
      "connections": {
        "a": [],
        "b": []
      },
      "planeId": null
    }
  ],
  "traversals": [],
  "regions": [
    {
      "id": "region.back",
      "name": "Return portal",
      "shape": {
        "kind": "rect",
        "rect": [
          32,
          512,
          32,
          64
        ]
      },
      "role": "trigger"
    }
  ],
  "entities": [
    {
      "id": "start.arrival",
      "name": "Forest arrival",
      "anchor": {
        "kind": "surface",
        "footholdId": "fh.floor",
        "u": 0.25,
        "normalOffset": 0
      },
      "enabled": true,
      "facing": "right",
      "visualId": null,
      "presentationId": "presentation.armor",
      "kind": "playerStart",
      "movementId": "movement.player",
      "default": true
    }
  ],
  "waypoints": [],
  "routes": [],
  "triggers": [],
  "encounters": [],
  "camera": {
    "model": {
      "key": "maplab.camera",
      "version": 1
    },
    "defaults": {
      "viewWU": [
        640,
        360
      ],
      "zoom": 1,
      "bounds": [
        0,
        0,
        640,
        640
      ],
      "followX": true,
      "followY": true,
      "deadZone": [
        0.375,
        0.25,
        0.25,
        0.5
      ],
      "dampingTicks": [
        8,
        12
      ],
      "lookaheadWU": [
        80,
        64
      ],
      "verticalPolicy": "platformSnap",
      "climbFollow": true,
      "transitionTicks": 15,
      "transition": "smoothstep"
    },
    "zones": [],
    "shakeEffects": []
  },
  "environment": {
    "ambientColor": "#ffffff",
    "effects": [],
    "zones": []
  },
  "navigation": {
    "modeVolumes": [],
    "links": [],
    "overrides": []
  },
  "flags": [],
  "prefabPlacements": []
}
