{"format":"maplab.map","version":1,"id":"map.dash.flat","metadata":{"name":"Owned dash flat","description":"Original ML-034 numeric geometry","authors":["MapLab"],"license":"CC0-1.0","tags":["conformance","ml-034"]},"requiredFeatures":[{"key":"maplab.collision","version":1},{"key":"maplab.camera","version":1}],"coordinates":{"units":"WU","x":"right","y":"down","rotation":"clockwiseDegrees","quantum":0.0625,"ticksPerSecond":60},"bounds":[-4,0,168,96],"collisionContract":{"key":"maplab.collision","version":1},"dependencies":[{"id":"movement.dash","kind":"movement","path":"movement/player.movement.json","required":true},{"id":"movement.dash.timer","kind":"movement","path":"movement/timer.movement.json","required":true},{"id":"movement.dash.fast","kind":"movement","path":"movement/fast.movement.json","required":true},{"id":"movement.dash.one","kind":"movement","path":"movement/one.movement.json","required":true},{"id":"movement.dash.none","kind":"movement","path":"movement/none.movement.json","required":true}],"assets":[],"presentations":[],"layers":[{"id":"layer.actors","name":"Actors","kind":"actors","parentId":null,"order":0,"visible":true,"opacity":1}],"terrain":[],"visuals":[],"materials":[{"id":"material.ground","name":"Ground","traction":256,"conveyorSu":0,"effect":null,"tags":[]}],"bodies":[{"id":"body.west","name":"west","position":[0,0],"enabled":true,"mobility":"static","category":"world","mask":["actor"],"materialId":"material.ground","shapes":[{"id":"shape.west","kind":"rect","rect":[0,48,160,4]}],"motion":null}],"footholds":[{"id":"fh.west","name":"west","ownerBodyId":"body.west","a":[0,48],"b":[160,48],"normal":"up","mode":"solid","solidEdge":{"bodyId":"body.west","shapeId":"shape.west","edgeIndex":0},"dropAllowed":false,"dropGroupId":null,"materialId":"material.ground","direction":"both","category":"world","mask":["actor"],"enabled":true,"connections":{"a":[],"b":[]},"planeId":null}],"traversals":[],"regions":[],"entities":[{"id":"start.dash","name":"Owned dash start","kind":"playerStart","enabled":true,"default":true,"movementId":"movement.dash","anchor":{"kind":"surface","footholdId":"fh.west","u":0.5,"normalOffset":0},"facing":"right","visualId":null,"presentationId":null}],"waypoints":[],"routes":[],"triggers":[],"encounters":[],"camera":{"model":{"key":"maplab.camera","version":1},"defaults":{"viewWU":[88,80],"zoom":1,"bounds":[-4,0,168,96],"followX":true,"followY":true,"deadZone":[0.375,0.25,0.25,0.5],"dampingTicks":[8,12],"lookaheadWU":[80,64],"verticalPolicy":"platformSnap","climbFollow":true,"transitionTicks":15,"transition":"smoothstep"},"zones":[],"shakeEffects":[]},"environment":{"ambientColor":"#ffffff","effects":[],"zones":[]},"navigation":{"modeVolumes":[],"links":[],"overrides":[]},"flags":[],"prefabPlacements":[]}
