{
  "format": "maplab.map",
  "version": 1,
  "id": "map.contact.snap-follow",
  "metadata": {
    "name": "Owned contact fixture",
    "description": "Original ML-017 numeric contact geometry",
    "authors": [
      "MapLab"
    ],
    "license": "CC0-1.0",
    "tags": [
      "conformance",
      "ml-017"
    ]
  },
  "requiredFeatures": [
    {
      "key": "maplab.collision",
      "version": 1
    },
    {
      "key": "maplab.camera",
      "version": 1
    }
  ],
  "coordinates": {
    "units": "WU",
    "x": "right",
    "y": "down",
    "rotation": "clockwiseDegrees",
    "quantum": 0.0625,
    "ticksPerSecond": 60
  },
  "bounds": [
    0,
    0,
    640,
    640
  ],
  "collisionContract": {
    "key": "maplab.collision",
    "version": 1
  },
  "dependencies": [],
  "assets": [],
  "presentations": [],
  "layers": [
    {
      "id": "layer.actors",
      "name": "Actors",
      "kind": "actors",
      "parentId": null,
      "order": 0,
      "visible": true,
      "opacity": 1
    }
  ],
  "terrain": [],
  "visuals": [],
  "materials": [
    {
      "id": "material.ground",
      "name": "Ground",
      "traction": 256,
      "conveyorSu": 0,
      "effect": null,
      "tags": []
    }
  ],
  "bodies": [],
  "footholds": [
    {
      "id": "fh.a",
      "name": "a",
      "ownerBodyId": null,
      "a": [
        0,
        100
      ],
      "b": [
        64,
        100
      ],
      "normal": "up",
      "mode": "oneWay",
      "solidEdge": null,
      "dropAllowed": false,
      "dropGroupId": null,
      "materialId": "material.ground",
      "direction": "both",
      "category": "world",
      "mask": [
        "actor"
      ],
      "enabled": true,
      "connections": {
        "a": [],
        "b": [
          {
            "footholdId": "fh.b",
            "endpoint": "a"
          }
        ]
      },
      "planeId": null
    },
    {
      "id": "fh.b",
      "name": "b",
      "ownerBodyId": null,
      "a": [
        64,
        100
      ],
      "b": [
        128,
        132
      ],
      "normal": "up",
      "mode": "oneWay",
      "solidEdge": null,
      "dropAllowed": false,
      "dropGroupId": null,
      "materialId": "material.ground",
      "direction": "both",
      "category": "world",
      "mask": [
        "actor"
      ],
      "enabled": true,
      "connections": {
        "a": [
          {
            "footholdId": "fh.a",
            "endpoint": "b"
          }
        ],
        "b": []
      },
      "planeId": null
    }
  ],
  "traversals": [],
  "regions": [],
  "entities": [],
  "waypoints": [],
  "routes": [],
  "triggers": [],
  "encounters": [],
  "camera": {
    "model": {
      "key": "maplab.camera",
      "version": 1
    },
    "defaults": {
      "viewWU": [
        640,
        360
      ],
      "zoom": 1,
      "bounds": [
        0,
        0,
        640,
        640
      ],
      "followX": true,
      "followY": true,
      "deadZone": [
        0.375,
        0.25,
        0.25,
        0.5
      ],
      "dampingTicks": [
        8,
        12
      ],
      "lookaheadWU": [
        80,
        64
      ],
      "verticalPolicy": "platformSnap",
      "climbFollow": true,
      "transitionTicks": 15,
      "transition": "smoothstep"
    },
    "zones": [],
    "shakeEffects": []
  },
  "environment": {
    "ambientColor": "#ffffff",
    "effects": [],
    "zones": []
  },
  "navigation": {
    "modeVolumes": [],
    "links": [],
    "overrides": []
  },
  "flags": [],
  "prefabPlacements": []
}
