{"format":"maplab.map","version":1,"id":"map.jump.forest-gap","metadata":{"name":"Owned jump fixture","description":"Original ML-018 numeric jump/fall/drop geometry","authors":["MapLab"],"license":"CC0-1.0","tags":["conformance","ml-018"]},"requiredFeatures":[{"key":"maplab.collision","version":1},{"key":"maplab.camera","version":1}],"coordinates":{"units":"WU","x":"right","y":"down","rotation":"clockwiseDegrees","quantum":0.0625,"ticksPerSecond":60},"bounds":[0,0,1600,1000],"collisionContract":{"key":"maplab.collision","version":1},"dependencies":[],"assets":[],"presentations":[],"layers":[{"id":"layer.actors","name":"Actors","kind":"actors","parentId":null,"order":0,"visible":true,"opacity":1}],"terrain":[],"visuals":[],"materials":[{"id":"material.ground","name":"Ground","traction":256,"conveyorSu":0,"effect":null,"tags":[]}],"bodies":[{"id":"body.west","name":"west","position":[0,0],"enabled":true,"mobility":"static","category":"world","mask":["actor"],"materialId":"material.ground","shapes":[{"id":"shape.west","kind":"rect","rect":[0,300,512,200]}],"motion":null},{"id":"body.east","name":"east","position":[0,0],"enabled":true,"mobility":"static","category":"world","mask":["actor"],"materialId":"material.ground","shapes":[{"id":"shape.east","kind":"rect","rect":[640,300,512,200]}],"motion":null}],"footholds":[{"id":"fh.west","name":"west","ownerBodyId":"body.west","a":[0,300],"b":[512,300],"normal":"up","mode":"solid","solidEdge":{"bodyId":"body.west","shapeId":"shape.west","edgeIndex":0},"dropAllowed":false,"dropGroupId":null,"materialId":"material.ground","direction":"both","category":"world","mask":["actor"],"enabled":true,"connections":{"a":[],"b":[]},"planeId":null},{"id":"fh.east","name":"east","ownerBodyId":"body.east","a":[640,300],"b":[1152,300],"normal":"up","mode":"solid","solidEdge":{"bodyId":"body.east","shapeId":"shape.east","edgeIndex":0},"dropAllowed":false,"dropGroupId":null,"materialId":"material.ground","direction":"both","category":"world","mask":["actor"],"enabled":true,"connections":{"a":[],"b":[]},"planeId":null}],"traversals":[],"regions":[],"entities":[],"waypoints":[],"routes":[],"triggers":[],"encounters":[],"camera":{"model":{"key":"maplab.camera","version":1},"defaults":{"viewWU":[640,360],"zoom":1,"bounds":[0,0,640,640],"followX":true,"followY":true,"deadZone":[0.375,0.25,0.25,0.5],"dampingTicks":[8,12],"lookaheadWU":[80,64],"verticalPolicy":"platformSnap","climbFollow":true,"transitionTicks":15,"transition":"smoothstep"},"zones":[],"shakeEffects":[]},"environment":{"ambientColor":"#ffffff","effects":[],"zones":[]},"navigation":{"modeVolumes":[],"links":[],"overrides":[]},"flags":[],"prefabPlacements":[]}
