{
  "format": "maplab.map",
  "version": 1,
  "id": "map.forest",
  "metadata": {
    "name": "Owned flight geometry",
    "description": "Ground, one-way platforms, slope, ladder, rope, jump gap, pit, parallax, foreground, patrols, flyer, boss arena and a portal.",
    "authors": [
      "MapLab R1 specification"
    ],
    "license": "CC0-1.0",
    "tags": [
      "acceptance",
      "side-view",
      "r1"
    ]
  },
  "requiredFeatures": [
    {
      "key": "maplab.collision",
      "version": 1
    },
    {
      "key": "maplab.climb",
      "version": 1
    },
    {
      "key": "maplab.camera",
      "version": 1
    }
  ],
  "coordinates": {
    "units": "WU",
    "x": "right",
    "y": "down",
    "rotation": "clockwiseDegrees",
    "quantum": 0.0625,
    "ticksPerSecond": 60
  },
  "bounds": [
    0,
    0,
    160,
    128
  ],
  "collisionContract": {
    "key": "maplab.collision",
    "version": 1
  },
  "dependencies": [
    {
      "id": "movement.player",
      "kind": "movement",
      "path": "movement/player.movement.json",
      "required": true
    },
    {
      "id": "movement.ground",
      "kind": "movement",
      "path": "movement/ground.movement.json",
      "required": true
    },
    {
      "id": "movement.flyer",
      "kind": "movement",
      "path": "movement/flyer.movement.json",
      "required": true
    },
    {
      "id": "catalog.core",
      "kind": "catalog",
      "path": "catalogs/core.catalog.json",
      "required": true
    },
    {
      "id": "tileset.forest",
      "kind": "tileset",
      "path": "tilesets/forest.tileset.json",
      "required": true
    },
    {
      "id": "prefab.tree",
      "kind": "prefab",
      "path": "prefabs/tree.prefab.json",
      "required": false
    }
  ],
  "assets": [],
  "presentations": [],
  "layers": [
    {
      "id": "layer.actors",
      "name": "Actors",
      "parentId": null,
      "order": 5,
      "visible": true,
      "opacity": 1,
      "kind": "actors"
    }
  ],
  "terrain": [],
  "visuals": [],
  "materials": [
    {
      "id": "material.earth",
      "name": "Earth",
      "traction": 256,
      "conveyorSu": 0,
      "effect": null,
      "tags": [
        "ground"
      ]
    },
    {
      "id": "material.wood",
      "name": "Wood",
      "traction": 256,
      "conveyorSu": 0,
      "effect": null,
      "tags": [
        "wood"
      ]
    }
  ],
  "bodies": [],
  "footholds": [],
  "traversals": [],
  "regions": [
    {
      "id": "region.flight",
      "name": "Owned flight volume",
      "shape": {
        "kind": "rect",
        "rect": [
          0,
          0,
          160,
          128
        ]
      },
      "role": "flight"
    }
  ],
  "entities": [
    {
      "id": "start.player",
      "name": "Forest start",
      "anchor": {
        "kind": "world",
        "point": [
          12,
          32
        ]
      },
      "enabled": true,
      "facing": "right",
      "visualId": null,
      "presentationId": null,
      "kind": "playerStart",
      "movementId": "movement.flyer",
      "default": true
    }
  ],
  "waypoints": [],
  "routes": [],
  "triggers": [],
  "encounters": [],
  "camera": {
    "model": {
      "key": "maplab.camera",
      "version": 1
    },
    "defaults": {
      "viewWU": [
        640,
        360
      ],
      "zoom": 1,
      "bounds": [
        0,
        0,
        160,
        128
      ],
      "followX": true,
      "followY": true,
      "deadZone": [
        0.375,
        0.25,
        0.25,
        0.5
      ],
      "dampingTicks": [
        8,
        12
      ],
      "lookaheadWU": [
        80,
        64
      ],
      "verticalPolicy": "platformSnap",
      "climbFollow": true,
      "transitionTicks": 15,
      "transition": "smoothstep"
    },
    "zones": [],
    "shakeEffects": []
  },
  "environment": {
    "ambientColor": "#f4f1e6",
    "effects": [],
    "zones": []
  },
  "navigation": {
    "modeVolumes": [
      {
        "id": "nav.flight",
        "mode": "fly",
        "regionId": "region.flight",
        "profileIds": [
          "movement.flyer"
        ]
      }
    ],
    "links": [],
    "overrides": []
  },
  "flags": [],
  "prefabPlacements": []
}
