{"assets":[],"bodies":[{"category":"world","enabled":true,"id":"body.anchor","mask":["actor"],"materialId":"material.ground","mobility":"static","motion":null,"name":"anchor","position":[0,0],"shapes":[{"id":"shape.anchor","kind":"rect","rect":[28,2,8,2]}]},{"category":"world","enabled":true,"id":"body.thin","mask":["actor"],"materialId":"material.ground","mobility":"static","motion":null,"name":"thin","position":[0,0],"shapes":[{"id":"shape.thin","kind":"rect","rect":[36,18,0.0625,12]}]}],"bounds":[0,0,64,48],"camera":{"defaults":{"bounds":[0,0,64,48],"climbFollow":true,"dampingTicks":[8,12],"deadZone":[0.375,0.25,0.25,0.5],"followX":true,"followY":true,"lookaheadWU":[80,64],"transition":"smoothstep","transitionTicks":15,"verticalPolicy":"platformSnap","viewWU":[64,48],"zoom":1},"model":{"key":"maplab.camera","version":1},"shakeEffects":[],"zones":[]},"collisionContract":{"key":"maplab.collision","version":1},"coordinates":{"quantum":0.0625,"rotation":"clockwiseDegrees","ticksPerSecond":60,"units":"WU","x":"right","y":"down"},"dependencies":[{"id":"movement.grapple","kind":"movement","path":"movement/grapple.movement.json","required":true},{"id":"movement.limited","kind":"movement","path":"movement/limited.movement.json","required":true},{"id":"movement.short","kind":"movement","path":"movement/short.movement.json","required":true},{"id":"movement.wide","kind":"movement","path":"movement/wide.movement.json","required":true}],"encounters":[],"entities":[{"anchor":{"kind":"world","point":[32,26]},"default":true,"enabled":true,"facing":"right","id":"start.player","kind":"playerStart","movementId":"movement.grapple","name":"Grapple start","presentationId":null,"visualId":null}],"environment":{"ambientColor":"#f4f1e6","effects":[],"zones":[]},"flags":[],"footholds":[],"format":"maplab.map","id":"map.grapple.thin","layers":[{"id":"layer.actors","kind":"actors","name":"Actors","opacity":1,"order":5,"parentId":null,"visible":true}],"materials":[{"conveyorSu":0,"effect":null,"id":"material.ground","name":"Ground","tags":[],"traction":256}],"metadata":{"authors":["MapLab"],"description":"Original ML-038 numeric grapple corpus","license":"CC0-1.0","name":"Owned thin grapple world","tags":["conformance","ml-038"]},"navigation":{"links":[],"modeVolumes":[],"overrides":[]},"prefabPlacements":[],"presentations":[],"regions":[{"id":"region.approach","name":"Grapple approach","role":"patrol","shape":{"kind":"rect","rect":[0,4,64,40]}}],"requiredFeatures":[{"key":"maplab.camera","version":1},{"key":"maplab.collision","version":1}],"routes":[],"terrain":[],"traversals":[{"approachRegionId":"region.approach","edge":{"bodyId":"body.anchor","edgeIndex":2,"shapeId":"shape.anchor"},"id":"grapple.ceiling","kind":"grapple","points":[[32,4]],"requiredAbilities":["grapple"]}],"triggers":[],"version":1,"visuals":[],"waypoints":[]}
