{"assets":[],"bodies":[{"category":"world","enabled":true,"id":"body.floor","mask":["actor"],"materialId":"material.ground","mobility":"static","motion":null,"name":"Floor","position":[0,0],"shapes":[{"id":"shape.floor","kind":"rect","rect":[0,40,64,8]}]},{"category":"world","enabled":true,"id":"body.wall","mask":["actor"],"materialId":"material.ground","mobility":"static","motion":null,"name":"Wall","position":[0,0],"shapes":[{"id":"shape.wall","kind":"rect","rect":[28,16,2,24]}]}],"bounds":[0,0,64,48],"camera":{"defaults":{"bounds":[0,0,64,48],"climbFollow":true,"dampingTicks":[8,12],"deadZone":[0.375,0.25,0.25,0.5],"followX":true,"followY":true,"lookaheadWU":[80,64],"transition":"smoothstep","transitionTicks":15,"verticalPolicy":"platformSnap","viewWU":[64,48],"zoom":1},"model":{"key":"maplab.camera","version":1},"shakeEffects":[],"zones":[]},"collisionContract":{"key":"maplab.collision","version":1},"coordinates":{"quantum":0.0625,"rotation":"clockwiseDegrees","ticksPerSecond":60,"units":"WU","x":"right","y":"down"},"dependencies":[{"id":"catalog.actions","kind":"catalog","path":"catalogs/actions.catalog.json","required":true},{"id":"movement.actions","kind":"movement","path":"movement/actions.movement.json","required":true}],"encounters":[],"entities":[{"anchor":{"kind":"world","point":[8,40]},"default":true,"enabled":true,"facing":"right","id":"start.actions","kind":"playerStart","movementId":"movement.actions","name":"Action start","presentationId":null,"visualId":null}],"environment":{"ambientColor":"#f4f1e6","effects":[],"zones":[]},"flags":[],"footholds":[],"format":"maplab.map","id":"map.actions.wall","layers":[{"id":"layer.actors","kind":"actors","name":"Actors","opacity":1,"order":5,"parentId":null,"visible":true}],"materials":[{"conveyorSu":0,"effect":null,"id":"material.ground","name":"Ground","tags":[],"traction":256}],"metadata":{"authors":["MapLab"],"description":"Original ML-039 numeric corpus","license":"CC0-1.0","name":"Owned stateful action world","tags":["conformance","ml-039"]},"navigation":{"links":[],"modeVolumes":[],"overrides":[]},"prefabPlacements":[],"presentations":[],"regions":[],"requiredFeatures":[{"key":"maplab.camera","version":1},{"key":"maplab.collision","version":1}],"routes":[],"terrain":[],"traversals":[],"triggers":[],"version":1,"visuals":[],"waypoints":[{"anchor":{"kind":"world","point":[48,40]},"id":"waypoint.far","waitTicks":0}]}
